text,source
"trumps tariffs will they affect your tech prices? your email has been sent us president donald trump temporarily reduced tariffs on most countries to 10, but raised chinese tariffs to a whopping 145. as of april 18, the u.s. administration plans to meet with china regarding trade deals. hours after higher countryspecific tariffs took effect on april 9, trump announced that most countries would be receiving a 90day pause to allow time for trade negotiations. instead, they will be subject to a 10 levy while their representatives attempt to hammer out a deal with the us. china was the notable exception to this pause, with trump announcing that the country would be subject to an additional 125 tariff on all goods, effective immediately. on april 10, the white house clarified that this tariff is additive, meaning that it will be levied on top of the 20 tariff that was already in place. this brings the total tariff rates on chinese goods to a staggering 145. trump said that he was issuing this massive additional tariff on china because of a lack of respect that china has shown to the worlds markets. china is the uss third largest trading partner, after canada and mexico. tech devices remain the uss top import from china, so this 145 tariff will likely cause prices to rise significantly. this tariff will apply to common tech products such as smartphones, computers, monitors, game consoles, and lithiumion batteries, as well as less obvious items such as small kitchen appliances and air purifiers. despite the 10 tariff rate for most countries, no changes were made to the 25 tariffs levied on canada and mexico, which were originally instituted in february. goods compliant with the united statesmexicocanada agreement usmca, including auto parts from canada and mexico, continue to remain exempt. trump says that trade deficits where the us spends more on imports from these nations than it earns through exports are the result of higher foreign tariffs, nontariff barriers, and economic policies abroad that depress wages and limit domestic consumption. tariffs have also been applied to countries with low tariff rates but high trade surpluses with the us, like the uk and australia. the president managed to pass them without congressional approval, declaring a national emergency and claiming that persistent trade imbalances undermine national security by weakening us manufacturing and exposing supply chains to foreign dependence. seetrumps import tariffs how theyll shake prices, jobs, and trade separately, trump revoked the de minimis tariff exemptions onchinese and hong kong imports valued at 800or less. he announced the change on april 2, and it will take effect on may 2. this reversal will impact popular ecommerce companies, such as shein and temu, that ship directly to international consumers from warehouses in china and hong kong. beginning may 2, consumers will have to pay 30 import fees, with a minimum of a 25 fee per package this minimum will eventually rise to 50 per package. trump also intends to extend this policy to other countries with comparable exemptions. while these tariffs were brought to restore economic fairness, boost manufacturing, and create more jobs in the us, they are also expected to trigger price increases in tech products. according tocnbc, after trumps initial announcement on april 1, nvidias stock fell by 5, while apple and amazon fell by 6. this is due to fears that their operational costs will rise and supply chains, which rely heavily on overseas manufacturing and imports, will be disrupted. us chipmaker nvidia should be somewhat shielded from the impact due totrumps exemption on semiconductors, sparing it from the 32 tariff on chips manufactured in taiwan by tsmc. however, it remains unclear whether the semiconductor exemption will also cover the 10 baseline tariff on all imports. furthermore, the trump administration said on april 15 that exceptions for smartphones, computers and semiconductors from chinamay be temporary. apple products, mostly manufactured in china, india, and vietnam, are likely to become more expensive as the company passes increased import costs onto us consumers. the prices of iphones could rise to3,500if produced domestically. amazon might do the same, as a high proportion of the goods listed on its marketplace are from chinese sellers. the ecommerce giant will especially be impacted by the removal of the tax exemption on products under 800. theus relies on china and taiwanfor approximately 80 of its foundry capacity for 20 to 45nm chips and about 70 for 50 to 180nm chips. tech firms may attempt to shift sourcing to reciprocal tarifffree countries, but many will pass the additional costs to consumers instead. overall, the administrations dealmaking in regards to tariffs, essentially holding trade as a bargaining chip, has caused uncertainty and a dip in the stock market. on april 18, trumpsaidhis administration is in talks with china about a new tariff deal that could come clear in the next three or four weeks. these new tariffs come after those imposed in february 25 on all imports from canada and mexicoexcept energy resources and minerals,20 on chinese goods, and 25 on european union tech components like semiconductors. with 80 of us foundry capacity for key semiconductor sizes currently reliant on china and taiwan, experts predicted ripple effects across the entire tech sector, impacting everything from smartphones and cloud services to ai infrastructure. at the time, gil luria, head of technology research at d.a. davidson, toldbloombergthat part of the reason trump is implementing tariffs on goods from the e.u. is in retaliation for the region making a habit of fining major us companies, such asapple,google, andmeta, for whatever behavior they choose to penalize. he added that the e.u. may become combative in response, and the level to which it does will determine the scale of the tariffs impact on the big tech players. seewere the white houses tariffs calculations done by ai? the expanded tariffs onaluminiumandsteelfrom february are predicted to hit data center companies, as these materials are essential for server racks, cooling systems, and other infrastructure, driving up construction and equipment costs. the additional expenditure and potential supply chain disruption may be reflected in increased cloud storage prices from companies like aws, google cloud, and microsoft azure, as well as saas and ai companies that utilise largescale data processing. it could also delay plans to build new data centers that companies have earmarked to meet the growing demand for ai. nevertheless, the stated intention is to reduce dependence on foreign adversaries. while this may result in higher prices for consumers in the short term, it could also drive investment in domestic industries and boost supply chain resilience. seemicrosoft to invest 80 billion in ai data centers in fiscal 2025 even prior to the tariffs, many companies have been announcing plans to build new facilities within the us, which is a trend likely to continue. in march,tsmc pledged to expand its spendon building data centers in the us to 160 billion, which it deems the largest single foreign direct investment in u.s. history. in february,apple announced it will spend 500 billionon manufacturing and research in the us over the next four years. in january, thestargate projectwas launched, which saw companies including softbank, openai, and oracle dedicate 500 billion togenerative aiinfrastructure in the us, including data centers. in the press conference for the tsmc investment, trump added that there are still many more companies that want to announce construction projects stateside. such companies could absorb the business of foreign competitors in the chip, cloud, and other hardware markets. technologyadvice freelance contributing writer kara sherrer contributed to this article. catch up on the latest tech innovations that are changing the world, including iot, 5g, the latest about phones, security, smart cities, ai, robotics, and more. delivered tuesdays and fridays catch up on the latest tech innovations that are changing the world, including iot, 5g, the latest about phones, security, smart cities, ai, robotics, and more. delivered tuesdays and fridays trumps tariffs will they affect your tech prices? your email has been sent get the webs best business technology news, tutorials, reviews, trends, and analysisin your inbox. lets start with the basics. indicates required fields lost your password?request a new password please enter your email adress. you will receive an email message with instructions on how to reset your password. check your email for a password reset link. if you didnt receive an email dont forgot to check your spam folder, otherwisecontact support. this will help us provide you with customized content. thanks for signing up! keep an eye out for a confirmation email from our team. to ensure any newsletters you subscribed to hit your inbox, make sure to addto your contacts list.",https://www.techrepublic.com/article/trump-tariffs-tech-prices/
"welcome to techrepublic newsletters! select the newsletters youd like to have delivered to your inbox, and stay up to date on all your favorite techrepublic topics for free. its that simple. if you are already a member and wish to manage your newsletters. from the hottest programming languages to commentary on the linux os, get the developer and open source news and tips you need to know. learn the latest news and best practices about data science, big data analytics, artificial intelligence, data security, and more. strengthen your organizations it security defenses by keeping abreast of the latest cybersecurity news, solutions, and best practices. stay up to date on the latest in technology with daily tech insider australian edition. we bring you news on industryleading companies, products, and people, as well as highlighted articles, downloads, and top resources. youll receive primers on hot tech topics that are most relevant to au markets that will help you stay ahead of the game. be your companys microsoft insider by reading these windows and office tips, tricks, and cheat sheets. learn how to get the most out of google docs, google cloud platform, google apps, chrome os, and all the other google products used in business environments. discover the secrets to it leadership success with these tips on project management, budgets, and dealing with daytoday challenges. save time with the latest techrepublic premium downloads, including customizable it hr policy templates, glossaries, hiring kits, features, event coverage, and more. exclusively for you! catch up on the weeks essential technology news, mustread posts, and discussions that would be of interest to it pros working in the uk and europe. this is your goto resource for the latest news and tips on the following topics and more, xaas, aws, microsoft azure, devops, virtualization, the hybrid cloud, and cloud security. whether you want iphone and mac tips or the latest enterprisespecific apple news, weve got you covered. stay up to date on the latest in technology with daily tech insider. we bring you news on industryleading companies, products, and people, as well as highlighted articles, downloads, and top resources. youll receive primers on hot tech topics that will help you stay ahead of the game. keep informed about the latest site features, downloads, special offers, and products from techrepublic. keep informed about the latest site features, downloads, special offers, and products from techrepublic. catch up on the latest tech innovations that are changing the world, including iot, 5g, the latest about phones, security, smart cities, ai, robotics, and more. get the webs best business technology news, tutorials, reviews, trends, and analysisin your inbox. lets start with the basics. indicates required fields lost your password?request a new password please enter your email adress. you will receive an email message with instructions on how to reset your password. check your email for a password reset link. if you didnt receive an email dont forgot to check your spam folder, otherwisecontact support. this will help us provide you with customized content. thanks for signing up! keep an eye out for a confirmation email from our team. to ensure any newsletters you subscribed to hit your inbox, make sure to addto your contacts list.",https://www.techrepublic.com/newsletters/
"us officials claim deepseek ai app is designed to spy on americans your email has been sent a bipartisan report, recently issued by the us select committee on the chinese communist party ccp, accuses deepseek of a series of subversive, illegal, and immoral practices. moreover, the tech giant nvidia is also catching the ire of us government officials for supplying deepseek with the chips needed to create the ai models. the report, titled deepseek unmasked exposing the ccps latest tool for spying, stealing, and subverting u.s. export control restrictions, was published in april 2025. it levies numerous accusations against deepseek, including in addition to the aforementioned accusations, the report also links dozens of deepseek employees and researchers to the peoples liberation army pla, the military wing of the ccp. this report makes it clear deepseek isnt just another ai app its a weapon in the chinese communist partys arsenal, designed to spy on americans, steal our technology, and subvert u.s. law,said chairman john moolenaar rmi. deepseek has already been banned in some countries including australia, india, italy, south korea, and taiwan due to potential security concerns. its usage has also been banned by the us congress, nasa, and among government entities within the state of texas. deepseek wasnt the only company mentioned in the report the tech giant nvidia also faces accusations, including nvidia spokesman john rizzo previously issued a statement saying, in part we insist that our partners comply with all applicable laws, and if we receive any information to the contrary, act accordingly, asreported by the new york times. but nvidias statement isnt enough for the congressional committee, which is accusing countries like singapore and malaysia of purchasing chips and illegally exporting them to china. as such, the committee is asking nvidia to provide specific details concerning every customer account from no less than 11 asian countries. the committee is expecting nvidias response within two weeks. the us select committee on the ccp first began investigating deepseek and its rapid pace of technological advancement in february 2025. while their recent report includes some very serious allegations against both deepseek and nvidia, its important to remember that all parties remain innocent until proven guilty. catch up on the latest tech innovations that are changing the world, including iot, 5g, the latest about phones, security, smart cities, ai, robotics, and more. delivered tuesdays and fridays catch up on the latest tech innovations that are changing the world, including iot, 5g, the latest about phones, security, smart cities, ai, robotics, and more. delivered tuesdays and fridays us officials claim deepseek ai app is designed to spy on americans your email has been sent get the webs best business technology news, tutorials, reviews, trends, and analysisin your inbox. lets start with the basics. indicates required fields lost your password?request a new password please enter your email adress. you will receive an email message with instructions on how to reset your password. check your email for a password reset link. if you didnt receive an email dont forgot to check your spam folder, otherwisecontact support. this will help us provide you with customized content. thanks for signing up! keep an eye out for a confirmation email from our team. to ensure any newsletters you subscribed to hit your inbox, make sure to addto your contacts list.",https://www.techrepublic.com/article/news-deepseek-nvidia-ai-us-committee-chinese-communist-party/
"editorial policy your email has been sent we are committed to it professionals, managers, and executives lead organizations by providing the technology information and advice that helps their organizations grow, and techrepublic support them with news stories, insights, features, tutorials and product recommendations they can trust. we provide critical takeaways for readers who are in a hurry and indepth analysis and insights for those conducting deep research into products, news and issues. our partners and sponsors fund our highquality journalism and product evaluations, but they do not influence our coverage or editorial decisions. they understand that our value comes from our commitment to providing the best answer to our readers and that the trust that readers have in us brings the highestquality audience to our site. the insights and product analysis that appears in our articles reflects the judgment of our editors and writers that this is information our readers need to know and it passes through multiple layers of review before it appears on our pages. while we have decades of experience in tech, we continuously strive to stay on top of evolving technology. we may be compensated by vendors who appear on our product review pages through methods such as affiliate links or sponsored partnerships. this may influence how and where their products appear on our site, but vendors cannot pay to influence the content of our reviews. our judgment is not informed or influenced by ai. we conducted an analysis of our work against chatgpt and found that our human analysts and reviewers so far surpass what ai is currently capable of that any shortcuts would be a disservice to our readers. what you read on our pages is the painstaking analysis of our editors, writers and analysts. thats why we commit to disclose to our readers, vendors and buyers how we will and wont use ai in the research, writing and publishing of our content. we will not use generative ai and similar tools to we may use generative ai and similar tools to we will some portions of the techrepublic website have been translated for your convenience using translation software powered by thirdparty services, including aibased translators. reasonable efforts have been made to provide an accurate translation however, no automated translation is perfect nor is it intended to replace human translators. translations are provided as a service to users of the techrepublic website, and are provided as is. no warranty of any kind, either expressed or implied, is made as to the accuracy, reliability, or correctness of any translations made from english into any other language. some content such as images, videos, flash, etc. may not be accurately translated due to the limitations of the translation software. stay up to date on the latest in technology with daily tech insider. we bring you news on industryleading companies, products, and people, as well as highlighted articles, downloads, and top resources. youll receive primers on hot tech topics that will help you stay ahead of the game. delivered weekdays stay up to date on the latest in technology with daily tech insider. we bring you news on industryleading companies, products, and people, as well as highlighted articles, downloads, and top resources. youll receive primers on hot tech topics that will help you stay ahead of the game. delivered weekdays editorial policy your email has been sent get the webs best business technology news, tutorials, reviews, trends, and analysisin your inbox. lets start with the basics. indicates required fields lost your password?request a new password please enter your email adress. you will receive an email message with instructions on how to reset your password. check your email for a password reset link. if you didnt receive an email dont forgot to check your spam folder, otherwisecontact support. this will help us provide you with customized content. thanks for signing up! keep an eye out for a confirmation email from our team. to ensure any newsletters you subscribed to hit your inbox, make sure to addto your contacts list.",https://www.techrepublic.com/article/editorial-policy/
"connect with more active buying teams and shape the decisions they make a competitive advantage, available only at techtarget much more than technology, we guide you and help you to scale from build, through execution, to optimization, were there for you with more tech buyers doing more prepurchase research here than anywhere else, weve built a better context to support your gtm objectives. understand buyers. optimize strategies. shape decisions. market research, buyer insights, analyst guidance to help you stand out datadriven content focused on the topics buyers care about most stay top of mind make the short list access influence inmarket buyers to build pipeline target inmarket accounts engage active buying groups accelerate partnerled growth engaged audiences. polished experiences. maximum roi. advance in the markets you care about most the intent data revolution comes to healthcare tech marketing custom content to educate sellers and partners on why your solution matters find and prioritize the accounts and contacts that are inmarket for your solutions what you need to know to quickly speak to the needs of your buyer actionable market intelligence on real enterprise tech buyers access indepth research, purchase intent analytics analyst advice drill down on your specific gtm questions the industrys most precise and powerful intent data the industrys most precise and powerful intent data impactful materials grounded in analyst expertise and researchbased insights expertcrafted content, ready and waiting for you create unique content that excites engages more b2b buyers content fueled by expertise. strategies built for results. targeted branding solutions proven to increase consideration bridge the gap between brand and demand to expand access to new prospects. intentdriven leads that build pipeline for more pipeline and continuous audience engagement, combine new and existing material into powerful virtual programming. expertcrafted content ready waiting for you deliver a reliable stream of quality leads your fastest path to the deal dealclosing decision support the industrys most powerful account and prospectlevel intent data the brighttalk channel helps you to create and distribute content, making your brand and messaging discoverable to 32m professionals. every buyer has an email address, but with inboxes overflowing, the challenge for marketers isnt just reaching an audience but engaging them effectively. for demand gen emails, this means emily noelsenior content marketing associate demand generation marketing clear all filters blog post abm emea blog post abm content creation intent data marketing sales blog post abm blog post abm channel partner marketing sales and marketing alignment blog post partner marketing blog post intent data blog post intent data sales sales enablement blog post demand generation blog post abm marketing blog post partner marketing blog post content creation demand generation intent data partner marketing sales and marketing alignment blog post content creation intent data marketing blog post demand generation intent data marketing sales blog post demand generation intent data marketing blog post content creation market intelligence marketing blog post demand generation marketing blog post demand generation marketing sales blog post content creation market intelligence marketing blog post sales sales enablement blog post content creation marketing blog post content creation market intelligence blog post content creation market intelligence marketing blog post intent data partner marketing blog post partner marketing blog post intent data sales sales enablement blog post partner marketing blog post intent data marketing sales blog post content creation marketing blog post content creation blog post content creation marketing blog post emea sales and marketing alignment blog post intent data blog post partner marketing blog post partner marketing blog post content creation blog post content creation blog post partner marketing blog post content creation blog post content creation blog post content creation blog post content creation blog post channel emea blog post demand generation intent data blog post abm advertising content creation intent data blog post abm intent data blog post partner marketing blog post abm sales sales and marketing alignment blog post partner marketing blog post partner marketing blog post partner marketing blog post intent data blog post content creation intent data blog post advertising intent data blog post intent data blog post intent data market intelligence blog post emea intent data blog post abm content creation demand generation intent data marketing",https://www.techtarget.com/blog/
