text,source
"netbrain this week is launching version 12.1 of its eponymousnetwork automationplatform. this latest release represents a significant evolution in the companys approach to network management, with a strong emphasis on ai capabilities that aim to transform how enterprises handle complex network environments. netbrain today is an automation and ai platform for network visibility, lingping gao, founder and ceo of netbrain technology, toldnetwork world. the problem we try to solve is how to automate network mapping first as adigital twin, then how to automate the troubleshooting to solve problems without human involvement, and then drive that further to things like assessment and changes. the 12.1 release represents the culmination of this vision introducing a series of advanced features. key highlights of netbrain nextgen 12.1 the core innovation in netbrain 12.1 lies in how it positions ai within network management workflows. where previous versions used ai as a tool or copilot, 12.1 elevates ai to function as an expert problem solver. this release is all about the next level of ai, which is ai as a problem solver, ai as an expert,gaoexplained. when a problem is submitted to netbrain, the system executes itsautomation tools, orchestrating them through ai to diagnose issues, recommend fixes and even close tickets automatically. as an example,gaosaid that if an organization sends a trouble ticket from servicenow into the netbrains ai agent, without any human involvement, the problem can be triaged and remediated. the system can provide a summary of the actions that were executed and then close the trouble ticket. at the foundation of netbrains platform is its multitiered digital twin technology, which creates a model of network infrastructure. unlike basic network mapping tools that focus primarily on device discovery, netbrain builds a fourlayered model gaoemphasized that in his view, the key to managing a modern network is to understand intent. the 12.1 release enhances this capability with the automatic discovery of network intent. the goal is to create a distributed, intelligent network modeling system that can discover and manage network intent without heavy human intervention, using ai and automation to continuously assess and adapt network configurations. as part of the 12.1 update, the new postmortem analysis feature allows organizations to quickly investigate network issues across their entire infrastructure. the system will automatically scan an entire network for similar problems after an outage. by using intentbased network mapping, ai and automation, netbrain will then take the initial postmortem findings and use that information for ongoing monitoring, tracking similar potential failure points across the network and proactively identifying potential future incidents. looking ahead, netbrain is working on creating more aipowered network automation capabilities to reduce the need for handson human interventions. this vision represents a significant shift in network management, with ai increasingly handling complex operational tasks that previously required human expertise, allowing network professionals to focus on more strategic initiatives. more and more human tasks are shifting to automation, with more automation shifting to ai,gaosaid. i can see 50 of network operations tasks now can be ai enabled in a matter of months right now. sean michael kerner is an it consultant, technology enthusiast and tinkerer, and has been known to spend his spare time immersed in the study of the klingon language and satellite pictures of area 51. he has pulled token ring, configured netware and has been known to compile his own linux kernel. he consults to industry and media organizations on technology issues. sponsored links",https://www.networkworld.com/article/3959191/netbrain-boosts-ai-smarts-to-automatically-diagnose-remediate-network-problems.html
"heightened enduser expectations and a greater emphasis on digitalization are rewiring the business landscape again. businesses looking to sharpen their competitive edge and stay innovative in this climate must tap into solutions such as artificial intelligence ai, machine learning ml and hybrid multicloud. yet, this new digital landscape has seen more fragmented data sources and disparate systems than ever, resulting in siloed operations, security vulnerabilities, and inefficiencies. and with idc concluding thatnetwork security and data securityare among the key priorities of businesses in the next few years with global spending seeing a 13 cagr between 2021 and 2026 modernizing the network infrastructure is a must. to ensure a successful transformation, the convergence of connectivity and security will make up the core of this strategy. a secure and intelligent modern network that can support the deployment of emerging technologies across sites and hybrid workplaces should lay the foundation of this transformation. in addition, this network should be capable of defending businesses against an unpredictable threat landscape. for a solution to deliver on this promise of connectivity, a crucial feature is a unified platform for managing multiple digital tools integrating mobile, cloud, internet of things iot, and networking tools into a single platform. not only can enterprises leverage this to manage a variety of connections, networks, and data sources centrally, they can also connect seamlessly across communication channels to enhance collaboration between departments. and with selfservice tools, network management can be centralized via the platform, making operations leaner and more efficient. central to such a platform, too, is integrated network and security. bringing these two pillars of a modern network together should deliver advanced cybersecurity functions across fixed and 5g networks while supporting businesses to drive connectivity from the cloud to the edge. finally, endtoend visibility should be a key consideration for enterprises if they want a holistic view of the network ecosystem. with increased network oversight, businesses can enhance flexibility and agility of their digital infrastructure, while gaining reliable insights into their network. driving business growth with secure connectivity one example of a network solution that lets businesses navigate todays complex digital landscape with resilience issingtel cub. it eliminates the challenge of integrating disparate networks while breaking down network silos. at the same time, its extensive portfolio of wired and wireless connectivity offers businesses access to advanced technologies and expertise, so they can focus on driving innovation. the solution can also help enterprises navigate todays dynamic business landscape by offering bestinclass partnershipssingtel has a robust partner ecosystem supporting its comprehensive suite of solutions. this helps reduce the time and effort needed to deal with multiple suppliers, allowing organizations to optimize and secure their network environments effectively. find out more about howsingtel cubcan empower your business to thrive in a rapidly evolving digital landscape with a scalable, modern network. sponsored links",https://www.networkworld.com/article/3962476/why-digital-transformation-starts-with-an-intelligent-network-infrastructure.html
"there was mixed reaction from industry analysts monday over an announcement fromnvidiathat it plans to produceai supercomputersentirely in the us for the first time. the company said in ablog postthat, together with its manufacturing partners, it has commissioned more than one million square feet 92,900 square meters of manufacturing space to build and test nvidia blackwell chips in arizona, and ai supercomputers in texas. the post went on to say that nvidia plans to produce up to half a trillion dollars ofai infrastructurein the us through partnerships with tsmc, foxconn, wistron, amkor, and spil. it added, nvidia ai supercomputers are the engines of a new type of data center created for the sole purpose of processing artificial intelligence ai factories that are the infrastructure powering a new ai industry. manufacturing nvidia ai chips and supercomputers for american ai factories will create hundreds of thousands of jobs and drive trillions of dollars in economic security over the coming decades. in reaction,scott bickley, advisory fellow atinfotech research group, said, the reality of this announcement, based on the suppliers mentioned, specifically foxconn, wistron, amkor, and spil, speaks to the migration of the chip testing, packaging, and noderack assembly to the us to take the tariff issue off the table. the reference to chip manufacturing via tsmc is not new news, as those investment announcements have already been made weeks ago. as for the job creation prediction, he said he is skeptical that this announcement will lead to hundreds of thousands of new jobs, as nvidia claims, since employing robotics and manufacturing automation is a stated goal. this is, said bickley, a job killer, not a job enabler. the reality is that this announcement likely seeks to appease the us governments desire to reshore this work in the us. however, the majority of the final server assembly work already takes place in mexico today, at a much lower cost of labor than can be realized in the us. he said, likely a hedge to delay tariff impacts on nvidia products coupled with a strategy to start the process of building highly automated facilities that can close the labor arbitrage gap that exists today. patrick moorhead, founder and chief analyst atmoor insights strategy, said he was waiting for something out of nvidia, as the company has been quiet on things related to tariffs. the companys plans, he said, likely revolve aroundl11 production, which is the creation of a fully tested system. i doubt this includes pca mainboard manufacturing or they would have said this discretely. therefore, it is still likely that the mainboards will be produced in taiwan or mexico. the highestperformanceai serversare a challenge to build, test, and validate. therefore, said moorhead, it makes sense that nvidia would do this in the us for us customers. i believe some oems like dell technologies already do l11 in the us. the wildcard here is the import duties on the different components coming in from taiwan, china, and mexico. in the announcement, jensen huang, founder and ceo of nvidia, said, the engines of the worlds ai infrastructure are being built in the united states for the first time. adding american manufacturing helps us better meet the incredible and growing demand for ai chips and supercomputers, strengthens our supply chain and boosts our resiliency. the company stated that it will utilize its advanced ai, robotics, anddigital twin technologiesto design and operate the facilities, including employing nvidia omniverse to create digital twins of factories and nvidia isaac gr00t to build robots to automate manufacturing. nvidia blackwell chips have started production at tsmcs chip plants in phoenix, arizona, it said. nvidia is building supercomputer manufacturing plants in texas, with foxconn in houston, and with wistron in dallas. mass production at both plants is expected to ramp up in the next 1215 months. forrester senior analystalvin nguyensaid monday in an email that nvidias plan makes sense in light of the fluid tariff situation. leveraging partners such as foxconn, wistron, tsmc, amcor, and spil will help accelerate the development of a us ai server supply chain. this helps them preserve access to ai chips and infrastructure to companies with us locations without a cost penaltydisadvantage that could help erode their ai leadership position and slow down ai adoption in the us. further, the plan echoes his separate commentary last week about the tariffs, in which he predicted, when it comes to semiconductors, there will bemore foundries being built around the world as the push for geographic diversity and the supporting supply chains are deployed. this will be beneficial as there is less dependence on taiwan for the majority of chip production. he added, this may cause some changes to data center investments depending on the state of tariffs and the cost impacts by location. enterprises may be incentivized to time buildouts to where they see better returns, but this is where sovereignty laws ai and data will also have an impact and can completely change the basis for where to build data centers. paul barker is a freelance journalist whose work has appeared in a number of technology magazines and online with the subject matter ranging from cybersecurity issues and the evolving world of edge computing to information management and artificial intelligence advances. sponsored links",https://www.networkworld.com/article/3962011/nvidia-lays-out-plans-to-build-ai-supercomputers-in-the-us.html
"arm holdings expects its architecture will account for half of the data center cpu market share by the end of this year, and to help achieve those goals it has launched a batch of new migration tools for application porting. mohamed awad, senior vice president and general manager of the infrastructure business at arm made the claim in ablog posting, citing arms lower power consumption than x86 processors. as a result, armbased products have become increasingly popular even with the big cloud computing companies, which are concerned about the power drain of their massive bit barns, awad said. there has been considerable activity around arm in recent years. amazon web services, microsoft, and google have all design their own custom silicon for their respective cloud services. nvidia has entered the cpu business with its own arm processor, codenamed grace. qualcomm is reportedly looking to enter the market after several aborted attempts. japanese giant softbank acquired arm and attempted to sell it to nvidia in 2021 but the deal collapsed facing considerable opposition. and just last monthsoftbank acquired ampere, the maker of armbased server chips primarily used by oracle. thats just on the processing side. arm cores are also used in a number of smartnics for intelligent network routing. so to that end, arm has introduced a series of new developer tools and services designed to support rapid migration of x86 apps to the arm architecture. our goal is to ensure developers have comprehensive support and access to indepth resources for a seamless migration to arm, enabling them to fully maximize the benefits of arm in the cloud, wrote bhumik patel, director of server ecosystem development at arm in his ownblog post. through its learning paths tutorials along with workloadspecific technical walkthroughs, developers can receive assistance across the various stages of a migration project and can directly engage with arm cloud migration experts for project support. the cloud migration resource hub provides resources on migrating the most common workloads with over 100 stepbystep learning paths for migrating major workloads across multiple cloud platforms. in addition, the software ecosystem dashboard for arm provides uptodate information on compatible arm versions of major open source and commercial software components. in the cloud, developers moving ai workloads can use arm kleidi integrations in the latest generation of leading frameworks like opensource machine learning framework, pytorch and benefit from dramatic ai performance improvements on arm without taking any extra steps., experts say. these updates will have an immediate impact in assisting cloud developers in making their move to arm, but its not the only investment were making to ensure arm is the most developerfriendly platform, patel wrote. andy patrizio is a freelance journalist based in southern california who has covered the computer industry for 20 years and has built every x86 pc hes ever owned, laptops not included.the opinions expressed in this blog are those of the author and do not necessarily represent those of itworld, network world, its parent, subsidiary or affiliated companies. andy patrizio is a freelance journalist based in southern california who has covered the computer industry for 20 years and has built every x86 pc hes ever owned, laptops not included. the opinions expressed in this blog are those of the author and do not necessarily represent those of itworld, network world, its parent, subsidiary or affiliated companies. sponsored links",https://www.networkworld.com/article/3959748/arm-backs-big-data-center-ambitions-with-migration-tools.html
"cisco recently celebrated its 40 anniversary, and its mission to connect the world remains intact. its focused on critical areas such as ai and cybersecurity that have worldwide relevance, including in spain, where cisco has more than three decades of history, says andreu vilamitjana, general manager of cisco in iberia, who spoke recently at the companys engage event in madrid. one of the milestones highlighted by vilamitjana came in november 2022, when cisco announced plans to build a nextgeneration semiconductor design center in barcelona leveraging the eu chips act, a european union plan to strengthen europes competitiveness and capacity in the chip industry. this is one of the examples, in vilamitjanas words, of the companys involvement and vision in the country to achieve a more inclusive, fair and happy society. in addition, cisco has trained some 350,000 people in digital skills through programs such as digitaliza and cisco networking academy. vilamitjana also highlighted ciscos commitment to sustainability, its focus on clean energy, and its emphasis on artificial intelligence and the ethics of ai. in this regard, cisco has a dedicated 1 billion fund to boost startups. one of the pillars of ciscos current strategy is based on ai and the preparation of data centers that enable ai and that need, according to an internal study, more maturity for the future. although 47 of local organizations already allocate between 10 and 30 of their it budget to ai mainly in cybersecurity, data management and analytics only 9 have an infrastructure that is fully prepared to take advantage of ais potential. vilamitjana referred two additional areas of focus for the company. one is the creation of the workplace for the future, with new collaborative models and a multitude of connected devices, which is especially relevant in spain after the covid crisis that began in 2020. the second focus is cybersecurity, an area that cisco has been refining in recent years with major acquisitions such as splunk. this story originally appeared oncomputerworld spain. mario moreno es coordinador editorial en espaa decomputerworldy de su cabecera especializada en ciberseguridadcso y redactor decio sponsored links",https://www.networkworld.com/article/3959896/cisco-underscores-its-absolute-focus-on-areas-critical-to-spains-technological-development.html
"googles big bet on nuclear energy the race to power aidriven data centers is accelerating your email has been sent google has unveiled plans to lead the way in the adoption of nuclear energy for the data center. at data center world 2025 in washington d.c., the company explained some of the details of its partnership with kairos power to develop up to 500 mw of nuclear energy through small modular reactors smrs. backed by a 300 million grant from the us department of energys advanced reactor demonstration program, this initiative aims for initial deployment by 2030, with further expansion of the site through 2035. the race to power aidriven data centers is accelerating, and securing sustainable, reliable energy at scale is more critical than ever, said lucia tian, head of clean energy decarbonization at google. this project is one facet of googles goal to be carbon free on a 24 x 7 x 365 basis by matching our electricity demand with clean sources. for the last many years, the company has been a major purchaser of wind and solar energy resources, but the power requirements of the latest generative ai applications have changed the game. google needs more power than ever and is developing a broad portfolio of clean energy assets this now includes nuclear energy as well as geothermal power. this strategy is far more cost effective and dependable as we need to operate on more than variable wind and solar, said tian. anyone wanting to build a brand new largescale nuclear plant can expect to wait as long as a decade before they experience the benefits in terms of available energy production. smrs are seen as a way to reduce the delay. the first units are expected to enter operation by the end of the decade. tian touched upon the abrupt aboutface in public perception concerning nuclear energy. over the last two years, everything has changed, she said. until 2022, nuclear plants were either being shuttered or scheduled for decommissioning now, decommissioned facilities like palisades in michigan and three mile island in pennsylvania are being recommissioned. in addition, some of these recommissioned facilities will also host new smrs. support for new nuclear energy has surged in the us in the last couple of years, said tian. those communities where there is active nuclear energy generation are incredibly supportive. however, some countries are less accepting of nuclear energy, and we have to be sensitive to local needs. seegoogle, amazon, meta back goal of massively increasingly global nuclear capacity by 2050 tian stressed the importance of partnering in the development of nuclear energy resources. google is an expert at cloud, search, ai, and many other facets of it but not energy generation hence, the companys partnership with kairos power in the development of smrs. jeff olson, vice president of business development finance at kairos power, said google is catalyzing the revival of nuclear energy and smrs in the us. his company is developing and commercializing a 150 mw reactor modules of this size can be grouped together to create larger blocks of generation. initial smr designs of a scaleddown version have been undergoing extensive testing. once finished, a fullsize unit will be built and validated before kairos goes into the commercialization phase. we thought utilities would be our first customers, but google came along with a strong desire to accelerate development, said olson. kairos power thought 150 mw would be more than enough for the data center market, but customers like google are now talking about 1 gw data centers. this need can be met, he said, by combining a series of 150 mw smr units at one site. the more units you deploy, the greater the economies of scale, said olson. the data center industry is inspiring nuclear innovation, and ai is creating the demand. learn how to get the most out of google docs, google cloud platform, google apps, chrome os, and all the other google products used in business environments. delivered fridays learn how to get the most out of google docs, google cloud platform, google apps, chrome os, and all the other google products used in business environments. delivered fridays googles big bet on nuclear energy the race to power aidriven data centers is accelerating your email has been sent get the webs best business technology news, tutorials, reviews, trends, and analysisin your inbox. lets start with the basics. indicates required fields lost your password?request a new password please enter your email adress. you will receive an email message with instructions on how to reset your password. check your email for a password reset link. if you didnt receive an email dont forgot to check your spam folder, otherwisecontact support. this will help us provide you with customized content. thanks for signing up! keep an eye out for a confirmation email from our team. to ensure any newsletters you subscribed to hit your inbox, make sure to addto your contacts list.",https://www.techrepublic.com/article/news-google-nuclear-energy-data-centers/
